{
  "$schema": "http://json-schema.org/draft-04/schema#",
  "id": "treatment_transition",
  "title": "Treatment transition",
  "type": "object",
  "namespace": "urn:nmmi:lu177-psma:model",
  "category": "clinical",
  "program": "*",
  "project": "*",
  "description": "A post-course therapy transition, retreatment, or a dated assessment that no subsequent therapy has yet occurred.",
  "additionalProperties": false,
  "submittable": true,
  "validators": null,
  "links": [
    {
      "name": "prior_courses",
      "backref": "nmmi_treatment_transition_prior_courses",
      "label": "follows",
      "target_type": "therapy_course",
      "multiplicity": "many_to_one",
      "required": true
    },
    {
      "name": "subsequent_courses",
      "backref": "nmmi_treatment_transition_subsequent_courses",
      "label": "initiates",
      "target_type": "therapy_course",
      "multiplicity": "many_to_many",
      "required": false
    },
    {
      "name": "medications",
      "backref": "nmmi_treatment_transition_medications",
      "label": "documents",
      "target_type": "medication",
      "multiplicity": "many_to_many",
      "required": false
    },
    {
      "name": "treatment_decisions",
      "backref": "nmmi_treatment_transition_treatment_decisions",
      "label": "motivated_by",
      "target_type": "treatment_decision",
      "multiplicity": "many_to_many",
      "required": false
    },
    {
      "name": "provenance_records",
      "backref": "nmmi_treatment_transition_provenance_records",
      "label": "documented_by",
      "target_type": "provenance",
      "multiplicity": "many_to_many",
      "required": false
    }
  ],
  "required": [
    "type",
    "submitter_id",
    "prior_courses",
    "transition_type",
    "transition_status"
  ],
  "uniqueKeys": [
    [
      "id"
    ],
    [
      "project_id",
      "submitter_id"
    ]
  ],
  "systemProperties": [
    "id",
    "project_id",
    "state",
    "created_datetime",
    "updated_datetime"
  ],
  "properties": {
    "type": {
      "enum": [
        "treatment_transition"
      ]
    },
    "submitter_id": {
      "type": "string",
      "description": "Stable submitter-assigned identifier, unique within a project. Do not encode direct patient identifiers.",
      "minLength": 1
    },
    "model_version": {
      "type": "string",
      "description": "Version of the submitting theranostics extension, independently of the MIDRC baseline version."
    },
    "record_status": {
      "type": "string",
      "description": "Record curation state, independent of clinical value.",
      "enum": [
        "draft",
        "reviewed",
        "approved",
        "superseded",
        "withdrawn"
      ]
    },
    "source_record_id": {
      "type": "string",
      "description": "Identifier of the originating source record; use an approved pseudonym when needed."
    },
    "source_system": {
      "type": "string",
      "description": "Source system or data provider."
    },
    "missing_properties": {
      "type": "array",
      "description": "Names of properties missing from this record; no missing value is encoded as zero.",
      "items": {
        "type": "string"
      }
    },
    "missing_reasons": {
      "type": "array",
      "description": "Reasons corresponding by index to missing_properties.",
      "items": {
        "enum": [
          "unknown",
          "not_collected",
          "not_applicable",
          "not_available",
          "withheld",
          "pending"
        ]
      }
    },
    "assessment_datetime": {
      "type": "string",
      "description": "ISO 8601 assessment datetime; use approved date shifting consistently within the case.",
      "format": "date-time"
    },
    "days_from_course_start": {
      "type": "number",
      "description": "Signed elapsed days from the linked therapy course start."
    },
    "time_basis": {
      "type": "string",
      "description": "Interpretation of stored dates and elapsed times.",
      "enum": [
        "actual",
        "shifted",
        "relative_only",
        "unknown"
      ]
    },
    "time_window_start_day": {
      "type": "number",
      "description": "Beginning of assessment window relative to course start, in days."
    },
    "time_window_end_day": {
      "type": "number",
      "description": "End of assessment window relative to course start, in days."
    },
    "id": {
      "pattern": "^[a-fA-F0-9]{8}-[a-fA-F0-9]{4}-[a-fA-F0-9]{4}-[a-fA-F0-9]{4}-[a-fA-F0-9]{12}$",
      "systemAlias": "node_id",
      "term": {
        "description": "A 128-bit identifier. Depending on the mechanism used to generate it, it is either guaranteed to be different from all other UUIDs/GUIDs generated until 3400 AD or extremely likely to be different. Its relatively small size lends itself well to sorting, ordering, and hashing of all sorts, storing in databases, simple allocation, and ease of programming in general.\n",
        "termDef": {
          "cde_id": "C54100",
          "cde_version": null,
          "source": "NCIt",
          "term": "Universally Unique Identifier",
          "term_url": "https://ncit.nci.nih.gov/ncitbrowser/ConceptReport.jsp?dictionary=NCI_Thesaurus&version=16.02d&ns=NCI_Thesaurus&code=C54100"
        }
      },
      "type": "string"
    },
    "project_id": {
      "term": {
        "description": "Unique ID for any specific defined piece of work that is undertaken or attempted to meet a single requirement.\n"
      },
      "type": "string"
    },
    "state": {
      "default": "validated",
      "downloadable": [
        "uploaded",
        "md5summed",
        "validating",
        "validated",
        "error",
        "invalid",
        "released"
      ],
      "oneOf": [
        {
          "enum": [
            "uploading",
            "uploaded",
            "md5summing",
            "md5summed",
            "validating",
            "error",
            "invalid",
            "suppressed",
            "redacted",
            "live"
          ]
        },
        {
          "enum": [
            "validated",
            "submitted",
            "released"
          ]
        }
      ],
      "public": [
        "live"
      ],
      "term": {
        "description": "The current state of the object.\n"
      }
    },
    "created_datetime": {
      "oneOf": [
        {
          "format": "date-time",
          "type": "string"
        },
        {
          "type": "null"
        }
      ],
      "term": {
        "description": "A combination of date and time of day in the form [-]CCYY-MM-DDThh:mm:ss[Z|(+|-)hh:mm]\n"
      }
    },
    "updated_datetime": {
      "oneOf": [
        {
          "format": "date-time",
          "type": "string"
        },
        {
          "type": "null"
        }
      ],
      "term": {
        "description": "A combination of date and time of day in the form [-]CCYY-MM-DDThh:mm:ss[Z|(+|-)hh:mm]\n"
      }
    },
    "prior_courses": {
      "type": "array",
      "items": {
        "type": "object",
        "additionalProperties": false,
        "properties": {
          "submitter_id": {
            "type": "string",
            "minLength": 1
          },
          "id": {
            "pattern": "^[a-fA-F0-9]{8}-[a-fA-F0-9]{4}-[a-fA-F0-9]{4}-[a-fA-F0-9]{4}-[a-fA-F0-9]{12}$",
            "systemAlias": "node_id",
            "term": {
              "description": "A 128-bit identifier. Depending on the mechanism used to generate it, it is either guaranteed to be different from all other UUIDs/GUIDs generated until 3400 AD or extremely likely to be different. Its relatively small size lends itself well to sorting, ordering, and hashing of all sorts, storing in databases, simple allocation, and ease of programming in general.\n",
              "termDef": {
                "cde_id": "C54100",
                "cde_version": null,
                "source": "NCIt",
                "term": "Universally Unique Identifier",
                "term_url": "https://ncit.nci.nih.gov/ncitbrowser/ConceptReport.jsp?dictionary=NCI_Thesaurus&version=16.02d&ns=NCI_Thesaurus&code=C54100"
              }
            },
            "type": "string"
          }
        },
        "oneOf": [
          {
            "required": [
              "submitter_id"
            ]
          },
          {
            "required": [
              "id"
            ]
          }
        ]
      },
      "uniqueItems": true,
      "description": "References to therapy_course records.",
      "minItems": 1,
      "maxItems": 1
    },
    "subsequent_courses": {
      "type": "array",
      "items": {
        "type": "object",
        "additionalProperties": false,
        "properties": {
          "submitter_id": {
            "type": "string",
            "minLength": 1
          },
          "id": {
            "pattern": "^[a-fA-F0-9]{8}-[a-fA-F0-9]{4}-[a-fA-F0-9]{4}-[a-fA-F0-9]{4}-[a-fA-F0-9]{12}$",
            "systemAlias": "node_id",
            "term": {
              "description": "A 128-bit identifier. Depending on the mechanism used to generate it, it is either guaranteed to be different from all other UUIDs/GUIDs generated until 3400 AD or extremely likely to be different. Its relatively small size lends itself well to sorting, ordering, and hashing of all sorts, storing in databases, simple allocation, and ease of programming in general.\n",
              "termDef": {
                "cde_id": "C54100",
                "cde_version": null,
                "source": "NCIt",
                "term": "Universally Unique Identifier",
                "term_url": "https://ncit.nci.nih.gov/ncitbrowser/ConceptReport.jsp?dictionary=NCI_Thesaurus&version=16.02d&ns=NCI_Thesaurus&code=C54100"
              }
            },
            "type": "string"
          }
        },
        "oneOf": [
          {
            "required": [
              "submitter_id"
            ]
          },
          {
            "required": [
              "id"
            ]
          }
        ]
      },
      "uniqueItems": true,
      "description": "References to therapy_course records."
    },
    "medications": {
      "type": "array",
      "items": {
        "type": "object",
        "additionalProperties": false,
        "properties": {
          "submitter_id": {
            "type": "string",
            "minLength": 1
          },
          "id": {
            "pattern": "^[a-fA-F0-9]{8}-[a-fA-F0-9]{4}-[a-fA-F0-9]{4}-[a-fA-F0-9]{4}-[a-fA-F0-9]{12}$",
            "systemAlias": "node_id",
            "term": {
              "description": "A 128-bit identifier. Depending on the mechanism used to generate it, it is either guaranteed to be different from all other UUIDs/GUIDs generated until 3400 AD or extremely likely to be different. Its relatively small size lends itself well to sorting, ordering, and hashing of all sorts, storing in databases, simple allocation, and ease of programming in general.\n",
              "termDef": {
                "cde_id": "C54100",
                "cde_version": null,
                "source": "NCIt",
                "term": "Universally Unique Identifier",
                "term_url": "https://ncit.nci.nih.gov/ncitbrowser/ConceptReport.jsp?dictionary=NCI_Thesaurus&version=16.02d&ns=NCI_Thesaurus&code=C54100"
              }
            },
            "type": "string"
          }
        },
        "oneOf": [
          {
            "required": [
              "submitter_id"
            ]
          },
          {
            "required": [
              "id"
            ]
          }
        ]
      },
      "uniqueItems": true,
      "description": "References to medication records."
    },
    "treatment_decisions": {
      "type": "array",
      "items": {
        "type": "object",
        "additionalProperties": false,
        "properties": {
          "submitter_id": {
            "type": "string",
            "minLength": 1
          },
          "id": {
            "pattern": "^[a-fA-F0-9]{8}-[a-fA-F0-9]{4}-[a-fA-F0-9]{4}-[a-fA-F0-9]{4}-[a-fA-F0-9]{12}$",
            "systemAlias": "node_id",
            "term": {
              "description": "A 128-bit identifier. Depending on the mechanism used to generate it, it is either guaranteed to be different from all other UUIDs/GUIDs generated until 3400 AD or extremely likely to be different. Its relatively small size lends itself well to sorting, ordering, and hashing of all sorts, storing in databases, simple allocation, and ease of programming in general.\n",
              "termDef": {
                "cde_id": "C54100",
                "cde_version": null,
                "source": "NCIt",
                "term": "Universally Unique Identifier",
                "term_url": "https://ncit.nci.nih.gov/ncitbrowser/ConceptReport.jsp?dictionary=NCI_Thesaurus&version=16.02d&ns=NCI_Thesaurus&code=C54100"
              }
            },
            "type": "string"
          }
        },
        "oneOf": [
          {
            "required": [
              "submitter_id"
            ]
          },
          {
            "required": [
              "id"
            ]
          }
        ]
      },
      "uniqueItems": true,
      "description": "References to treatment_decision records."
    },
    "provenance_records": {
      "type": "array",
      "items": {
        "type": "object",
        "additionalProperties": false,
        "properties": {
          "submitter_id": {
            "type": "string",
            "minLength": 1
          },
          "id": {
            "pattern": "^[a-fA-F0-9]{8}-[a-fA-F0-9]{4}-[a-fA-F0-9]{4}-[a-fA-F0-9]{4}-[a-fA-F0-9]{12}$",
            "systemAlias": "node_id",
            "term": {
              "description": "A 128-bit identifier. Depending on the mechanism used to generate it, it is either guaranteed to be different from all other UUIDs/GUIDs generated until 3400 AD or extremely likely to be different. Its relatively small size lends itself well to sorting, ordering, and hashing of all sorts, storing in databases, simple allocation, and ease of programming in general.\n",
              "termDef": {
                "cde_id": "C54100",
                "cde_version": null,
                "source": "NCIt",
                "term": "Universally Unique Identifier",
                "term_url": "https://ncit.nci.nih.gov/ncitbrowser/ConceptReport.jsp?dictionary=NCI_Thesaurus&version=16.02d&ns=NCI_Thesaurus&code=C54100"
              }
            },
            "type": "string"
          }
        },
        "oneOf": [
          {
            "required": [
              "submitter_id"
            ]
          },
          {
            "required": [
              "id"
            ]
          }
        ]
      },
      "uniqueItems": true,
      "description": "References to provenance records."
    },
    "transition_type": {
      "type": "string",
      "description": "Kind of subsequent treatment or dated follow-up status.",
      "enum": [
        "subsequent_systemic_therapy",
        "psma_rpt_retreatment",
        "no_subsequent_therapy_observed",
        "other"
      ]
    },
    "transition_status": {
      "type": "string",
      "description": "Whether a transition is planned, occurred, or not yet observed.",
      "enum": [
        "planned",
        "occurred",
        "not_yet_observed",
        "unknown"
      ]
    },
    "post_lu177_therapy_received": {
      "type": "boolean",
      "description": "Indicates whether the patient received any subsequent anticancer therapy after completion or discontinuation of ¹⁷⁷Lu-PSMA RPT. Per PCWG3, all subsequent therapies must be recorded until death as they affect OS interpretation."
    },
    "retreatment_performed": {
      "type": "boolean",
      "description": "Dated status of retreatment performed."
    },
    "agent_name": {
      "type": "string",
      "description": "Name of the anticancer agent(s) administered after ¹⁷⁷Lu-PSMA RPT, recorded in order of administration."
    },
    "reason": {
      "type": "string",
      "description": "Reason for initiating subsequent anticancer therapy after ¹⁷⁷Lu-PSMA."
    },
    "start_date": {
      "type": "string",
      "description": "Date on which the first subsequent anticancer therapy was initiated after ¹⁷⁷Lu-PSMA RPT.",
      "format": "date"
    },
    "last_prior_administration_date": {
      "type": "string",
      "description": "Transition last prior administration date.",
      "format": "date"
    },
    "last_followup_date": {
      "type": "string",
      "description": "Transition last followup date.",
      "format": "date"
    }
  }
}
